<?xml version="1.0" encoding="iso-8859-1"?>
<ddb xsi:schemaLocation="http://ciax.sum.naoj.org/ciax-xml/schema/ddb.xsd" xmlns="http://ciax.sum.naoj.org/ciax-xml/ddb" xmlns:xsi="http://www.w3.org/2001/XMLSchema-instance">
  <device id="oss" label="OSS Command line">
    <cmdselect>
      <command id="getstat" label="Get all status" response="getstat" type="stat">
        <data label="Status Command" text="OSSC_screenPrint -R" type="text" />
        <data label="InR Select(NsOpt/NsIR/Cas)" text=" TSCV.RotatorType" type="text" />
        <data label="Stow pin Status" text=" CXWS.TSCV.STOW_1" type="text" />
        <data label="Shutter Status" text=" CXWS.TSCV.SHUTTER" type="text" />
        <data label="AZ/EL Drive Status" text=" CXWS.TSCV.TELDRIVE" type="text" />
        <data label="EL Angle(deg)" text=" CXWS.TSCS.EL" type="text" />
        <data label="CIAX-MLP3 Comm Error" text=" CXWS.TSCV.CIAX_MLP3_FAULT" type="text" />
        <data label="InR Drive ON/OFF" text=" TSCV.InsRotRotation" type="text" />
        <data label="BOLT Status" text=" CXWS.TSCV.0_SENSOR" type="text" />
      </command>
      <command id="iststat" label="Get Instrument ID" response="iststat" type="stat">
        <data label="Status Command" text="OSSC_screenPrint -R" type="text" />
        <data label="CAS Instrument" text=" CXWS.TSCV.OBE_INR" type="text" />
      </command>
      <command id="jakstat" label="Jack Bolt Status" response="jakstat" type="stat">
        <data label="Status Command" text="OSSC_screenPrint -R" type="text" />
        <data label="Bolt Each Status" text=" CXWS.TSCV.POWER_V1" type="text" />
        <data label="Bolt Each Position" text=" CXWS.TSCV.POWER_V2" type="text" />
        <data label="Zsensor Each Position" text=" CXWS.TSCL.Z_SENSOR" type="text" />
      </command>
      <command id="inrstat" label="Cas InR Status" response="inrstat" type="stat">
        <data label="Status Command" text="OSSC_screenPrint -R" type="text" />
        <data label="InR Angle(deg)" text=" CXWS.TSCS.INSROT" type="text" />
      </command>
      <command id="logstat" label="Login Status" response="logstat" type="stat">
        <data label="Status Command" text="OSSC_screenPrint -R" type="text" />
        <data label="LOGIN 0" text=" TSCV.TSC.LOGIN0" type="text" />
        <data label="LOGIN 1" text=" TSCV.TSC.LOGIN1" type="text" />
        <data label="LOGIN 2" text=" TSCV.TSC.LOGIN2" type="text" />
        <data label="LOGIN 3" text=" TSCV.TSC.LOGIN3" type="text" />
      </command>
      <command id="getexit" label="Exit Code" response="exit" type="stat">
        <data text="cat $HOME/.var/exit.txt" type="text" />
      </command>
      <command id="login" label="TSC Login" response="exit">
        <data text="OSST_ciaxTSCcommand 10 'EXEC TSC NATIVE CMD=&quot;cccccc" type="text" />
        <data text="1A1901 " type="text" />
        <data text="ciax%%%%%%%%%%%%%%%% " type="text" />
        <data text="CIAX%%%%%%%%%%%% " type="text" />
        <data text="dummyunit dummyMenu dummyMessage" type="text" />
        <data text="&quot;';echo $?|tee $HOME/.var/exit.txt" type="text" />
      </command>
      <command id="logout" label="TSC Logout" response="exit">
        <data text="OSST_ciaxTSCcommand 10 'EXEC TSC NATIVE CMD=&quot;cccccc" type="text" />
        <data text="1A1902" type="text" />
        <data text="&quot;';echo $?|tee $HOME/.var/exit.txt" type="text" />
      </command>
      <command id="setinst" label="Set Instrument ID [0-12]" response="exit" type="config">
        <parameters>
          <par label="Inst ID [0-12]" range="1:12"></par>
        </parameters>
        <data text="OSST_ciaxTSCcommand 10 'EXEC TSC NATIVE CMD=&quot;cccccc" type="text" />
        <data text="13200700" type="text" />
        <data format="%02d" text="$1" type="formula" />
        <data text="&quot;';echo $?|tee $HOME/.var/exit.txt" type="text" />
      </command>
      <command id="config" label="Execute Config Command [code]" response="exit">
        <parameters>
          <par label="Command Code" pattern=".+"></par>
        </parameters>
        <data text="OSST_ciaxTSCcommand 10 'EXEC TSC NATIVE CMD=&quot;cccccc" type="text" />
        <data text="$1" type="formula" />
        <data text="&quot;';echo $?|tee $HOME/.var/exit.txt" type="text" />
      </command>
      <command id="ossact" label="Execute Action Command [code]" response="exit" type="action">
        <parameters>
          <par label="Command Code" pattern=".+"></par>
        </parameters>
        <data text="ossact" type="text" />
        <data text="$1" type="formula" />
      </command>
    </cmdselect>
    <cmdframe>
      <selected />
      <data encode="chr" label="Suffix" text="0xa" type="text" />
    </cmdframe>
    <rspselect>
      <response id="getstat">
        <field assign="rsel" label="InR Select(NsOpt/NsIR/Cas)" />
        <field assign="stow_1" decode="hexstr" label="Stow pin Status" />
        <field assign="shutter" label="Shutter Status" />
        <field assign="teldrive" label="AZ/EL Drive Status" />
        <field assign="el" label="EL Angle(deg)" />
        <field assign="mlp3" label="CIAX-MLP3 Comm Error" />
        <field assign="rpw" label="InR Drive ON/OFF" />
        <field assign="bstat" decode="hexstr" label="BOLT System Status" />
      </response>
      <response id="iststat">
        <field assign="iid" label="CAS Instrument" />
      </response>
      <response id="jakstat">
        <field assign="bsa" label="BOLT SUM ALM(POWER_V1)" length="2" />
        <field assign="cjb" label="ALL BOLT STAT(POWER_V1)" length="2" />
        <array assign="bl" label="Each Bolt Status(POWER_V1)" length="1">
          <index range="0:15" size="16" />
        </array>
        <array assign="be" label="Each Bolt Alarm(POWER_V1)" length="1">
          <index range="0:15" size="16" />
        </array>
        <field assign="mba" label="MLP3-BOLT COMM(POWER_V1)" length="2" />
        <field label="Cut off" />
        <field assign="bcl" label="BOLT CONTROL SOURCE(POWER_V1)" length="2" />
        <field assign="cjh" label="Jack Home(POWER_V1)" length="4" />
        <array assign="jk" label="Bolt Position(POWER_V2)" length="12">
          <index range="0:15" size="16" />
        </array>
        <array assign="zp" label="Zsensor Position" length="12" slice="2:4">
          <index range="0:3" size="4" />
        </array>
      </response>
      <response id="inrstat">
        <field assign="iang" label="InR Angle(deg)" />
      </response>
      <response id="logstat">
        <field assign="login0" label="LOGIN 0" />
        <field assign="login1" label="LOGIN 1" />
        <field assign="login2" label="LOGIN 2" />
        <field assign="login3" label="LOGIN 3" />
      </response>
      <response id="exit">
        <field assign="exit" label="Exit Code" />
      </response>
    </rspselect>
    <rspframe delimiter="\n">
      <selected />
    </rspframe>
  </device>
</ddb>